This is the edid log with Genesys ZU 3EG on 2022.07.09

Connected "J8" serial port with USB cable to laptop for capturing this bootlog with Putty.

Connected "DP TX" with mini displayport to displayport cable to HP Compaq LA2306x 
(XN375AA XN375AT)

Turning power on to Genesys.

Connected "USB HOST" to USB keyboard.

Text login console comes up on display and it is possible to enter login information
with USB keyboard and login to Genesys command line.

cat /sys/class/drm/card0-DP-1/edid | edid-decode

-----------------------------------------------------------

Extracted contents:
header:          00 ff ff ff ff ff ff 00
serial number:   22 f0 49 29 01 01 01 01 2d 16
version:         01 04
basic params:    a5 33 1d 78 26
chroma info:     1e 55 a0 59 56 9f 27 0d 50 54
established:     a1 08 00
standard:        81 c0 81 80 95 00 b3 00 d1 c0 01 01 01 01 01 01
descriptor 1:    02 3a 80 18 71 38 2d 40 58 2c 45 00 fd 1e 11 00 00 1e
descriptor 2:    00 00 00 fd 00 32 4c 18 5e 11 00 0a 20 20 20 20 20 20
descriptor 3:    00 00 00 fc 00 48 50 20 4c 41 32 33 30 36 0a 20 20 20
descriptor 4:    00 00 00 ff 00 33 43 51 32 34 35 31 37 43 56 0a 20 20
extensions:      00
checksum:        b5

Manufacturer: HWP Model 2949 Serial Number 16843009
Made week 45 of 2012
EDID version: 1.4
Digital display
8 bits per primary color channel
DisplayPort interface
Maximum image size: 51 cm x 29 cm
Gamma: 2.20
DPMS levels: Off
Supported color formats: RGB 4:4:4
Default (sRGB) color space is primary color space
First detailed timing is preferred timing
Established timings supported:
  720x400@70Hz
  640x480@60Hz
  800x600@60Hz
  1024x768@60Hz
Standard timings supported:
  1280x720@60Hz
  1280x1024@60Hz
  1440x900@60Hz
  1680x1050@60Hz
  1920x1080@60Hz
Detailed mode: Clock 148.500 MHz, 509 mm x 286 mm
               1920 2008 2052 2200 hborder 0
               1080 1084 1089 1125 vborder 0
               +hsync +vsync 
Monitor ranges (GTF): 50-76Hz V, 24-94kHz H, max dotclock 170MHz
Monitor name: HP
Serial number: 3CQ24517CV
Checksum: 0xb5 (valid)
EDID block does NOT conform to EDID 1.3!
	Detailed block string not properly terminated
